jobTitle,companyName,location,pay,category,postedDate,description,jobURL
AML Investigations Analyst,BOQ Group,Brisbane QLD,True hybrid working | 50/50 WFH + office based,,29/07/2025,"About the RoleIf you're someone who thrives on uncovering patterns, connecting dots, and making sense of complex data to protect the integrity of financial systems?îthis role is calling your name.As an AML Investigations Analyst at BOQ Group, you?ôll be part of a high-performing team that?ôs laser-focused on identifying and investigating suspicious activity across our retail and institutional banking products. You?ôll dive deep into transaction monitoring alerts, Unusual Activity Reports (UARs), and referrals from our Fraud and Scam teams, using your analytical mindset to assess behaviours and flag anything that doesn?ôt sit right.Your work will directly support our Suspicious Matter Reporting (SMR) obligations to AUSTRAC, and you?ôll be instrumental in ensuring our investigations are structured, well-documented, and delivered with precision. You?ôll be working in alignment with our Financial Crime Strategy and AML/CTF regulatory obligations, helping us stay one step ahead of emerging risks and typologies.There?ôs also room to stretch beyond the day-to-day?îwhether it?ôs contributing to continuous improvement initiatives or supporting broader Financial Crime Operations projects. If you?ôre ready to make a meaningful impact and be part of a team that?ôs passionate about doing things the right way, we?ôd love to hear from you.About youYou ??our preferred candidate, you?ôve got experience in a similar role and a solid understanding of the AML/CTF landscape, you know how to interpret transaction data, and how to build a case that stands up to scrutiny. You?ôre confident navigating financial crime processes, and you understand the responsibilities of key regulators and the importance of timely, accurate reporting.You have worked in banking operations or operational risk before, and if you?ôve submitted SMRs or hold qualifications like ACAMS, ICA, or CCP, that?ôs a bonusYou?ôre a natural communicator?îwhether it?ôs writing up investigation findings or collaborating with stakeholders across the business. You?ôre curious, methodical, and have a knack for critical thinking. You know how to manage priorities, work independently, and contribute meaningfully to a team.But more than anything, you bring a proactive mindset, a genuine interest in financial crime risk, and a desire to grow your career in a place that values integrity, collaboration, and purpose. If this sounds like you, we would love to hear from you!About UsBOQ Group is a truly unique group of challenger brands with a purpose ??to provide a genuine alternative to Australian financial services for customers and employees.Our family of brands (Bank of Queensland (BOQ), ME Bank, Virgin Money Australia, BOQ Specialist), each come with their own defined customer audience and brand personality, but share one goal ??to build social capital through banking. That?ôs creating trust with customers, exploring staff potential and believing that tiny gestures and big ideas can change the world for communities.BOQ Group?ôs inclusive vision is to foster a workspace that values and leverages difference and creates new possibilities, a place where our people feel confident to bring their best selves to work every day. We embrace difference and believe that our workforce should reflect the customers and communities that we serve.Since 2021, BOQ Group is recognised as an Employer of Choice for Gender Equality by the Workplace Gender Equality Agency (WGEA).In 2023, we successfully implemented an innovative Reconciliation Plan, driving positive change and promoting inclusivity across BOQ Group.Our PerksAt BOQ Group, we are passionate about creating an exceptional work environment that nurtures both your professional and personal growth. Our comprehensive benefits package is designed to enhance your well-being, provide financial security, and foster a sense of community and inclusion. Here are just some of the fantastic perks you can enjoy as part of our team:Flexible working arrangement- Balance your work and personal life with ease.Discounted financial products- Enjoy exclusive rates on our financial services across the Group.Salary sacrificing options- Maximise your take-home pay with our salary packaging options.Paid parental leave with no minimum requirements- Spend quality time with your new family member without any worries.Purchase additional annual leave- Need more time off? You can buy extra leave days.Discounted private health insurance plan- Take care of your health with our special rates.Employee Assistance Program (EAP)- Access confidential support for personal and professional challenges for you and your familyAccess to employee network groups- Connect with peers through our First Nations Reconciliation, LGBTQIA+, Multicultural, Gender, Early Careers, and accessibility groups.Pride in Diversity membership: We are proud members of Pride in Diversity and actively participate in the Australian Workplace Equality Index.We are committed to creating a workplace where everyone feels valued and supported. Join us and be part of a company that truly cares about its people and community!How to ApplyTo apply for this role at #boqgroup,?follow the links or apply via our Careers Page.BOQ Group?is committed to diversity and an inclusive workforce. Aboriginal and Torres Strait Islander People are encouraged to apply.We celebrate, value and include people of all backgrounds, gender and expressions, sexualities, cultures, bodies and abilities. When you apply, you are welcome to tell us the pronouns you use and please let us know any reasonable adjustments you may need during the interview process.If you are successful for a role with BOQ Group, it is a condition of employment that background screening is completed to ensure that the Bank complies with its obligations under the Anti-Money Laundering and Counter Terrorism Financing Act. These checks may include, but are not limited to: identity, verification, reference checks, criminal background checks, immigration checks, verification of academic qualifications, bankruptcy checks.Please no agency applications.",https://www.seek.com.au/job/86082522&ref=search-standalone
Head of Risk Analytics & Reporting,Heritage and People's Choice,Brisbane QLD(Hybrid),,,29/07/2025,"Lead meaningful transformation at scale across the enterprise.Supportive, values-driven culture with strong executive commitment to risk excellence.Hybrid work model that supports work-life balance.About the roleAs we shape the future of People First Bank, we?ôre looking for an experienced and visionary Head of Risk Analytics & Reporting to lead the enterprise-wide development and execution of risk data, analytics, and reporting strategies.This newly created leadership role offers the unique opportunity to influence our risk culture from the ground up and shape how we manage and interpret risk across our changing organisation.As the Head of Risk Analytics and Reporting, you?ôll be responsible for delivering high-quality, timely and actionable risk insights that support decision-making at every level. You?ôll lead a small team of risk specialists to create robust, data-driven reporting frameworks, embed a comprehensive risk data strategy, and leverage AI and automation to enhance analytics capability and risk intelligence across the enterprise.What You?ôll Be DoingLeading the design and implementation of our enterprise risk data, reporting, and analytics strategy.Building and continuously enhancing a suite of standardised risk dashboards and reports to inform executive, Board and regulatory decision-making.Partnering with Line 1 and Risk domain leaders to deliver on the Risk Management Strategy and uplift our frameworks.Utilizing predictive analytics and emerging technologies to proactively identify risks and support forward-looking decision-making.Representing People First Bank in regulatory interactions relating to risk data and reporting.Ensuring our risk reporting is accurate, insightful, timely, and aligned with our business strategy and risk appetite.Acting as Data Steward for Group Risk, with responsibility for lifecycle management of Governance Risk and Compliance (GRC) platforms and model validation.About YouYou are an experienced risk leader with a collaborative approach who combines strategic thinking with deep technical knowledge. You are passionate about risk analytics and its potential to transform how we manage risk and drive performance.Your Skills and ExperienceSubstantial experience in financial services risk with deep expertise in risk analytics and reporting.Strong understanding of regulatory and compliance obligations in financial services.Demonstrated experience working with GRC systems and developing reporting frameworks.Proven ability to engage, influence and communicate effectively with senior stakeholders.Experience leading teams and uplifting risk culture.Strategic mindset with a practical, performance-driven approach to execution.A curious, collaborative and accountable leadership style aligned to PFB?ôs values.Completion of formal tertiary qualifications in business, risk, management or technology is also essential.Why you?ôll love working with us:People First Bank ??our new brand ??says exactly what we?ôre all about: people. We're committed to supporting and growing our team and creating an outstanding work environment.You?ôll have access to financial and lifestyle benefits to support your success and individuality:Flexibility and hybrid working arrangements.Extend your salary with discounts on banking, health insurance, and shopping across Australia.Advance your career with training, study support, and project opportunities.Competitive leave benefits that empower employees to take time for themselves and loved ones.Wellbeing support with our Employee Assistance Program, wellbeing leave, mental health app, and mental health ambassadors??program.Make a difference with paid volunteering, Workplace Giving, and diverse community initiatives.Be recognised for your contributions through our peer-driven recognition program.A bit about People First Bank:In March 2023, People?ôs Choice and Heritage Bank merged to form Heritage and People?ôs Choice Limited - Australia's leading mutual bank.? We are now on an exciting journey to bring together our products, services, and technology under a single brand -?People First Bank.We have over 700,000 members and 1,900 employees, with dual head offices in Adelaide and Toowoomba, an Australian-based contact centre and branches across five states.With a vision ?òTo deliver positive change through banking?? People First Bank serves members and contributes to the community, while offering an inclusive, flexible work environment. We?ôre big enough to make an impact; but agile enough to influence and do interesting work.Apply online now:If you are ready to join a supportive team who are passionate about the work they do and the results they achieve, then apply now.If this sounds like you, this could be the next step in your career. Click 'Apply' now and submit your application.We are committed to diversity and inclusion and support candidate requests for adjustments to enable everyone to equitably participate in our selection process.",https://www.seek.com.au/job/86083383&ref=search-standalone
Informatics Officer,Metro South Health,"Cleveland, Brisbane QLD","$90,832 to $100,071 per annum",,29/07/2025,"Your new Role:Join us as an Informatics Officer, supporting data quality and patient safety across Bayside Health. You'll work with clinical teams, resolve data issues, and help drive continuous improvement in a fast paced, team focused environment.About you:Have excellent verbal and written communication skills to liaise confidently with clinical and administrative teamsUse strong analytical and problem solving skills to investigate and resolve data discrepancies across multiple health systems through hospital information systems and audit trails.Work both independently and collaboratively to achieve team objectivesBuild and maintain positive relationships across multidisciplinary teams and stakeholdersBe passionate about accuracy, quality, and continuous improvement in health dataWhat we can offer you:Flexible working arrangements like flex time, leave options, and reduced hours to support work life balance.Collaborative, supportive team environment focused on innovation and continuous improvement.Access to advanced health information systems and technologies.Connection to leading tertiary institutions through renowned teaching and research programs.Benefits of Queensland's public health system including generous leave, competitive salary, salary packaging, professional development support, study assistance, corporate discounts, and wellness programs.Redland Hospital:Redland Hospitalis the major health centre for adults and children in the Redlands and Brisbane's southern bayside suburbs. We provide a range of services including emergency care, primary health and minor injury care, acute and subacute medicine, general surgery, maternity and paediatric, mental specialist outpatient and mental health care.It's an exciting time as our Redlands Coast community grows bringing a diverse range of patients & an opportunity to make a real difference in the community. With more beds, new and expanding services the Redland Hospital expansion provides a range of opportunities to pursue and build a long-term career, enjoy a supportive work environment, professional growth opportunities, and a vibrant community!Now's the time to join the team at Redland Hospital! You'll have all the benefits of working for a growing metropolitan hospital.INTEGRITY | COMPASSION | ACCOUNTABILITY | RESPECT | ENGAGEMENT | EXCELLENCEOur valueswere created by employees for employees to shape our culture and inspire positive interactions in the workplace. Diversity of ideas, skills, traditions, and customs is celebrated as one of our greatest strengths. Having a workforce that reflects and understands the needs and expectations of our community is important to delivering safe, kinder, and more inclusive care.We recognise ourstrengthcomes from thediversity of our peopleand so we encourage people of all genders, ethnicities, ages, abilities, languages, sexual orientation, and family responsibilities to apply.We are Metro South Health:We are the major public healthcare provider for Brisbane's south side, Logan, Redlands, and the Scenic Rim operating five major hospitals and a range of community, specialty, and state-wide healthcare services.We are bold, innovative, collaborative, inspiring. We save lives, change lives, and make the world a better place. We are part of and proud of the community we serve.We arebetter together.",https://www.seek.com.au/job/86085162&ref=search-standalone
Asset Management Technical Officer,Bureau Of Meteorology,Brisbane QLD,"$115,443-125,832, + 15.4% super",,29/07/2025,"Asset Management Technical OfficerExecutive Level 1Salary: $115,443-125,832, plus an additional 15.4% superannuationPosition overviewThe Bureau's observing network assets portfolio is distributed across 12,500 sites covering all states and territories of Australia and other jurisdictions. Observing network assets include, but are not limited to, Radars, Automatic Weather Stations, Tsunami Boys, Rain Gauges and other measuring apparatus. The Asset Management Technical Officer will assist with the establishment and development of the Bureau's new asset management capability to ensure the efficient and effective lifecycle management of the Bureau's observing network asset portfolio.With their experience using and supporting Maximo or similar Enterprise Asset Management systems, the Asset Management Technical Officer will provide support and assistance to the broader asset management and operational teams. This assistance will extend to business and technical support, report and other configuration activities, maintenance of data integrity and participation in system uplift projects.A key measure of success will be the organisational adoption of an asset management culture involving the uptake and utilisation of the Enterprise Asset Management system, adherence to relevant policies and plans and the establishment of an environment that fosters collaboration and communication. The Asset Management Technical Officer will assist in this culture shift through the provision of guidance and training support to the wider organisation, the promotion of the asset management framework and strong collaboration with SMEs and asset owners.Using their asset management experience and commercial acumen, the Asset Management Technical Officer will be called upon to assist in the annual strategic planning cycle. This will involve provision of data and insight analysis for asset maintenance programs and budget setting.Whilst the initial focus of this position will be the Bureau's observing network assets portfolio, the role may be expanded in future to include a diverse and significant asset base, including property and facilities, ICT, software and intangible assets such as IP and models.Role responsibilitiesThe responsibilities of the role include but are not limited to:User SupportCommunicate and provide solutions to system users on both technical and operational support matters.Identify areas for improvement for usability and system performance and translate business needs into technical requirements.Assist with the development of Asset Management training collateral in collaboration with the Bureau's Training Centre.Support the adoption of an Asset Management culture through process reinforcement and ongoing guidance to individual users and user groups.Stakeholder CommunicationCreate relevant reports for asset performance and data integrity. using EAMS, other data sources, and reporting tools (e.g. PowerBI) as appropriate.Coordination of end-to-end processes including the integration and / or maintenance of other related systems.Provision of advice and recommended actions to the National Asset ManagerUpdate and maintain system documentation and user manuals.Liaising with stakeholders to achieve Asset Management team outcomes.Maintenance and Data IntegrityCreation and maintenance of asset hierarchies.Review technical information and asset configuration to build or verify asset structures.Defining and adhering to data standards in relation to data capture and data management.Confirm equipment specification and identification information through field validation.Update Location records to reflect current Location operating status.Create and maintain asset records:Review vendor / project information to verify asset records.Update asset records to reflect asset moves and configuration changes.Create and maintain Job Plans.Liaise with operational areas to consolidate and optimise Job Plans.Establish and communicate the budget impact for new or changed Job Plans.Update Master Data in EAMS, MDM and legacy systems as appropriate.Selection criteriaThe Bureau encourages applications from all suitably qualified candidates. Applications will be considered based on alignment with selection criteria, which have been matched to the APS work level standards and Integrated Leadership System (ILS) for Executive Level 1 positions.Highly DesirableQualifications:A tertiary qualification from an Australian educational institution, or a comparable overseas qualification, which is relevant to the duties;Capabilities and Behaviours:Skills and experienceExperience administering, and supporting for an Enterprise Asset Management System ??IBM MaximoFamiliar with Maximo or other software enhancement and development processes and testing requirementExperience in writing SQL queries to extract data from Maximo DB or other DBsAn analytical mindset, relational data analysis experience and an understanding of the integrity of systems and dataAn awareness of Asset Management concepts and standards and the ability to apply this knowledge to system configuration and maintenance processesHigh attention to detailAchieves resultsIn conjunction with management, establishes targets and delivers on intended results and outcomesProvides excellent service through provision of guidance and promotion of good practiceDevelops and supports innovative solutionsCommunicationDemonstrates excellent communication skills with internal and external stakeholdersDemonstrated ability to convey technical material and concepts in a way that is understood by business and technical audiences alikeDesirableAn appreciation of the importance of asset management in the Bureau's (or similar organisation) context and how that relates to personal actions and activityEffective identification of management asset risksProject scoping and development activitiesProvide input to monthly, quarterly and annual capital reporting processesPromote collaboration by identifying opportunities to work with other teams/units to solve issues and develop better processes and approaches to workExperience with reporting tools such as PowerBIMerit poolThe selection process will establish a merit pool that may be used to fill similar positions within 18 months.How to applyApplications can be lodged throughthe Bureau of Meteorology Careers.Your application will consist of resume, contact details for two referees and an ??00-word pitch??that considers:position overviewjob responsibilitiesselection criteria",https://www.seek.com.au/job/86078998&ref=search-standalone
Senior Financial Analyst,Mansell Taylor Consulting,Brisbane QLD(Hybrid),,,29/07/2025,"Join a growing commercial company based in Brisbane?ôs southern suburbs, offering a hybrid work setup and the opportunity to hit the ground running in a high-impact role.This is a fantastic short-term contract opportunity for an experienced Senior Financial Analyst or FP&A Specialist looking to start immediately.What You?ôll Be Doing:Take the lead in reviewing month-end reporting, ensuring accuracy and insightSupport the development of Board packs and executive-level commentaryConduct in-depth financial analysis and modelling to drive strategic decisionsPerform cost analysis to highlight efficiencies and risksContribute to ad hoc project-based financial assessments and reportingWork with internal systems to extract, model, and present financial dataAbout You:Proven experience in Financial Planning & Analysis or Senior Financial Analyst rolesStrong background in financial reporting, modelling, and business partneringAdvanced Excel skills and proficiency in financial systemsExcellent attention to detail and the ability to communicate insights clearlyAble to work both autonomously and collaboratively in a hybrid environmentA car and licence are essential due to the office location in Brisbane?ôs southern suburbsWhat?ôs on Offer:Immediate start3-month contract with potential for extensionFlexible hybrid working modelReady to bring your expertise to a business that values insight and initiative? Apply today and take the next step in your financial career.",https://www.seek.com.au/job/86088364&ref=search-standalone
