jobTitle,companyName,location,pay,category,postedDate,description,jobURL
Principal Benefits Analyst,Department of Health - Queensland,Brisbane QLD,,,29/07/2025,"As a Principal Benefits Analyst you will facilitate agreement with key stakeholders and ensure program and project benefits are identified, understood, measured, tracked and owned and that the required business change to enable successful benefits realisation is in place. You will work with program and projects and provide pragmatic best practice advice on the effectiveness of their benefits management and realisation practices, particularly to identify additional opportunities for benefits management. Additionally, you will assess benefits management across CES Programs portfolio of programs and projects to identify current gaps, overlaps and conflicts, and eliminate any double counting of program and project benefits.Role fit:Proven ability to establish, and manage, the provision of a benefits and value management, tracking and realisation service to support a number of large-scale, complex IM, ICT and digital programs and projects into operational service.Proven ability to identify, quantify, map, track and report progress of program and project benefits that justify continued investment in a program or project, and to provide assurance that the forecast benefits identified can be realised.Proven stakeholder relationship management skills to support effective business change, including the ability to influence key stakeholders.Why work with us?Work alongside passionate professionals in a supportive and inclusive environment that values people and prioritises employee success and wellbeing. This includes:Competitive salaries12.75% superannuation17.5% leave loadingEmployee wellbeing38 hour full time work weekAccess to 24/7 confidential employee support providers and counsellors including for immediate family membersAdditional flexibility to support your work life balance including access to generous leave entitlements, such as purchased leave, domestic violence leave, reproductive health leave, cultural leave, study and examination leave.Professional developmentCareer progression with more than 300 diverse career pathways and career support to take you further!Access to a variety of programs and initiatives to support training and career growth.Grow your skills through hands-on experience and access to internal training opportunities and additional financial and leave benefits for approved external training and development.Our commitment to equity, diversity and inclusionAt Queensland Health, our work environment is inclusive and supportive, and we value our employees. We are an equal opportunity employer and encourage applications from people of all cultures, abilities and backgrounds.Our commitment to cultural safety, equity, diversity and inclusion means we understand some people may need changes to the recruitment process. If you need support during the recruitment process, such as meeting with the panel virtually instead of in person, please reach out to the hiring manager. We value diverse candidates and your need for adjustments will not affect our hiring decisions.Ready to apply?For further information on how to apply please review the attached Role Description.Applications will remain current for a period of up to 12 months and may be considered for other vacancies which may include an alternative employment basis such as temporary, full time or part time.",https://www.seek.com.au/job/86074538&ref=search-standalone
IT Support Analyst,IntoWork Australia,"Scarborough, Brisbane QLD",Salary + Super,,29/07/2025,"We have an exciting opportunity?¶For an IT Support Analyst to join the team at IntoWork Australia, located in Scarborough, QLD. This is an excellent opportunity for a highly motivated and enthusiastic individual to join the team and be part of the IntoWork Group.The Company:IntoWork Australia is the leading national provider of Employment, Skills, Education and Support services that support economic and social participation. Everything we do, including our range of tailored pathways for individuals and workforce solutions for employers, is underpinned by our vision - 'Vibrant Futures' - for our staff, service users, and business clients.About the role:We're seeking someone with a strong background in IT Support. Working under the direction of the IT Customer Services Team Lead, the IT Support Analyst will ensure reported ITSM tasks are correctly categorised, manage requests / incidents through to resolution, or where necessary facilitate seamless escalation to senior resolver groups or vendors.Key Responsibilities:Provide customer-centric support, assisting your peers to effectively investigate, remediate and document technical issues.Use your passion and natural inquisitive for end user computing (application, software and hardware) to complete intuitive troubleshooting of identified incidents, documenting findings to support further investigations, or escalation as necessary.Be a key contributor to creation of knowledge of known errors and publish workarounds to facilitate efficient transfer of knowledge with your peers, and support problem management.Proactively assess inbound incidents, to quickly identify clusters of incidents to prioritise and confidently invoke major incident or problem management procedures to maintain service levels.Install, and maintain assets including provisioning and tracking of end users devices including laptops, printers and mobile phones.Write and present technical instruction to support peers within the IT team to work effectively and efficiently.Understand impact and urgency of consecutive incidents raised, and effectively manage priorities ensuring our clients expectations are met consistently.Ensure impacted clients communication is maintain for the life assigned requests or incidents.Have a broad understanding of end-to-end service delivery, to be able to undertake analysis of potential points of failure contributing to delivery of software and applications to expected service levels.Be confident accessing outputs from systems logs, monitoring tools and other operational outputs to understand potential issues and use internal and external knowledge sources to interpret to formulate potential solutions.Maintain and validate requests and incident records to ensure metadata is correct and use this data to assist with identification of broader systemic issues.Manage workload, and where necessary proactively work with the IT Customer Services Team Lead to ensure user expectations are met with relation to external service level agreements, as well as internal organisational level agreements.Key Selection Criteria:Certificate IV in Information Technology or similar industry qualification or experience.Demonstrated experience in some of the following IT related activities, including wide or local area network administration, desktop hardware or software support, IT operations support, security support.Knowledge of Microsoft applications and end user device hardware.Organisational ownership and values alignment.Work on and effectively prioritise multiple technical issues and customer updates.What's in it for you?Professional development and career growth opportunities.Access to the Employee Assistance & Wellbeing Program, including confidential counselling and financial, nutrition, and legal support services.A supportive team culture and dynamic work environment.Working with a national team of IT specialists.Join Us!If you're ready to grow your career in an organisation that values its people, click 'Apply' and attach your cover letter and resume.Applicants must be eligible to work in Australia. A current Working with Children Check and National Police Check are required (can be arranged for the successful applicant).",https://www.seek.com.au/job/86078808&ref=search-standalone
Research Officer/Senior Research Officer,QIMR Berghofer Medical Research Institute,"Herston, Brisbane QLD","$96,100 to $128,721 p.a. + super and packaging",,29/07/2025,"About QIMR Berghofer:QIMR Berghofer is a world-leading translational medical research institute focused on improving health by developing new diagnostics, better treatments and prevention strategies, specifically in the areas of Cancer, Infection and Inflammation, Mental Health, and Population Health. Based in Herston, Brisbane and working in close collaboration with clinicians and other research institutes, QIMR Berghofer is home to more than 600 scientists, students and non-research staff.About the Translational Neurogenomics Laboratory:The Translational Neurogenomics Laboratory has identified genetic and environmental risk factors for a range of psychiatric conditions, including substance use disorders, schizophrenia, depression, anxiety, and obsessive compulsive disorder. We have shown that: 1) genetic and environmental risk factors overlap across psychiatric disorders; 2) large phenotypic and genetic heterogeneity exists within psychiatric disorders. Our research aims to achieve a better understanding of the nature of psychiatric symptoms by modelling (longitudinal) relations. Ultimately, improved understanding of individual genetic and environmental risk factors (and their interactions) will translate to more effective treatment of psychiatric disorders.For this specific role, we are seeking a candidate with a background in psychology, epidemiology, statistics, data science, or a related quantitative discipline, who is interested in developing and applying quantitative models to symptom level and diagnostic data from large-scale biobanks. No previous experience with genetic analyses will be required, although it will be considered as a strength.The successful candidate will join this highly productive team as a (senior) postdoctoral researcher. You will have the opportunity to pursue your own research interests as well as contribute to the ongoing work of the team.The Translational Neurogenomics Laboratory offers an inclusive, supportive, and positive work environment.Role Purpose / Responsibilities:Your role includes the development and application of quantitative modelling approaches, such as Structural Equation Modelling (SEM), network analyses, and/or latent growth curve analyses. Methods will be applied to large scaled datasets such as UK Biobank and All of Us, with longitudinal data collected through surveys, wearables, physical measurements, and electronic health records (EHRs) in hundreds of thousands of participants. The project will achieve a better understanding of how genetic and environmental risk factors, and their interactions, influence trajectories of psychiatric symptoms.You will be encouraged to develop and pursue your own independent research interests and will be given the opportunity to (further) develop your leadership skills.You will contribute to the supervision of Undergraduate and PhD students.About you:The successful applicant will possess a PhD in Psychology, Statistics/Biostatistics, Computer Science, Epidemiology, Genetic Epidemiology, or other relevant discipline with a strong quantitative research background.You will have experience with quantitative modelling of high-dimensional data (e.g., network analyses, structural equation modelling, or latent class/latent growth curve analysis)You will be able to work within a team, while also independently developing your own research interests and skillsYou will have excellent communication and organisational skills; and good attention to detail.You enjoy working in a diverse and inclusive environment.Preference will be given to applicants with a very good publication record relative to opportunity.Remuneration:Salary range is $96,100 to $128,721 plus super and salary packaging. This is a full-time appointment for 1 year, with possible extension. The duration of the contract can be flexible for the right candidate. Salary will be determined on qualifications and experience.For further information:please contact Professor Eske Derks (she/her) by emaileske.derks@qimrberghofer.edu.auClosing Date:26 August 2025Applicants must be an Australian Citizen, Permanent Resident or hold a valid work permit or visa. Work eligibility will be checked as part of the recruitment process.To submit an application:use theAPPLYbutton. All applicants must supply the following documents: Resume and Cover letter addressing the selection criteria outlined in the Position Description.What we offer:Salary PackagingState of the art facilitiesStimulating work setting focussed on cutting edge medical researchSupportive/collaborative team environmentParental Leave Provisions",https://www.seek.com.au/job/86078934&ref=search-standalone
Business Analyst (Regulatory) - Fixed Term Contract,UpperGround by Hudson,Brisbane QLD(Hybrid),,,29/07/2025,"Key Accountabilities¬∑???? Legislative and Regulatory Analysis: Conduct in-depth analysis of legislation, policies, and operational processes to evaluate the impact of proposed changes being made by the project.¬∑???? Task Identification and Documentation: Identify, document, and prioritise specific tasks within each workstream, establishing appropriate timelines and identifying resources required for execution.¬∑???? Process Design & Process Mapping: Utilise process design and mapping techniques to document current and future-state processes, identifying areas for improvement and streamlining workflows.¬∑???? Reporting and Documentation: Prepare comprehensive documentation for the project including detailed analysis findings, solution options, and recommendations ensuring clarity for both technical and non-technical stakeholders.¬∑???? Workstream Implementation: Contribute to the implementation of high-priority workstreams, collaborating with cross-functional teams to ensure timely and effective delivery of project objectives.General¬∑???? Adhere to organisational?policies, procedures, and values.¬∑???? Undertake all required training and education applicable to the role.¬∑???? Take reasonable care for own health, safety, and wellbeing and adhere to and promote the objectives under the Health, Safety & Wellbeing Policy.¬∑???? Implement risk control measures and report new and emerging workplace hazards, risks and incidents that have caused, or are likely to result in injury, harm, and damage.¬∑???? Actively participate in workplace consultations, incident investigations, rehabilitation and return to work processes, and subsequent corrective and preventative actions.¬∑???? Comply with and uphold all information security standards, controls, and practices applicable to the role.¬∑???? Safeguard information assets, whether in digital, physical, or any other form, along with all the accompanying applications and devices.¬∑???? Other duties as directed and required.Qualification Requirements¬∑???????? Bachelor?ôs degree in relevant field, or¬∑???????? Certification or Qualifications in BABOK, CBAP, CCBA, or¬∑???????? Cert IV / Diploma in Business Analysis, or¬∑???????? Equivalent experience in Legal or Conveyancing¬∑???????? Atlassian Software (JIRA / Confluence) for tracking of project activities¬∑???????? Scrum master / agile project managementKey Capability RequirementsEssential:¬∑???????? Minimum five (5) years in similar role (eg; Business Analyst, Regulatory Analyst, Policy Analyst)¬∑???????? Experience working within both business / strategic and IT projects and programs of work¬∑???????? Advanced experience using Microsoft suite of applications¬∑???????? Intermediate experience in JIRA for project coordination tracking of project activities and deliverables and experience in the role of a Scrum Master¬∑???????? Strong written and oral communication skills, and relationship / stakeholder management¬∑???????? Excellent organisation and time management skills¬∑???????? High quality reporting and presentation material developmentPreferred:¬∑???????? Legal or Conveyancing experience.¬∑???????? Land titles administration experience.Diversity, Equity & Inclusion at HudsonHudson is committed to helping you find a workplace where you feel respected, supported, and free to thrive. We welcome applications from all backgrounds, identities, and lived experiences?îbecause when different voices come together, amazing things happen.Casual LoadingPlease note for allAustralianbased contract and temporary roles only, the pay rate is inclusive of?mandatory 25% casual loading. This excludes permanent and fixed term roles.",https://www.seek.com.au/job/86086889&ref=search-standalone
Tax Analyst,Suncorp,Brisbane QLD(Hybrid),,,29/07/2025,"Ready to take the next step in your finance career?Join Suncorp as a Tax Analyst and get hands-on experience with real tax challenges that make a difference. Work alongside supportive managers, collaborate with finance teams across the business, and gain exposure to all areas of corporate tax.This is a permanent full-time position based in Brisbane or Sydney, with an expected start date mid-to-late August 2025.What you?ôll doDive into tax compliance: gather financial data, assist with PAYG instalments, and help prepare annual corporate tax returns.Support tax effect accounting, ensuring our financial statements accurately reflect tax impacts.Collaborate with finance teams and tax managers across Suncorp, building strong relationships along the way.Use your problem-solving mindset to identify opportunities for automation and process improvements.Keep pace with tax developments through training, updates, and ?úlunch & learn??sessions.Build on your skills with Excel and financial systems in a role that blends detail, teamwork, and growth.What you?ôll bringA degree in Commerce, Accounting, Finance, Business, Law or related studies is mandatory1?? years of professional experience (including internships, placements, or grad programs) where you?ôve built confidence with data, systems, and teamwork.An eye for detail and strong analytical skills ??you enjoy solving problems and finding smarter ways to do things.Clear communication skills, adaptability, and a positive, solutions-focused attitude.Comfort with Excel and a willingness to keep learning.What we can offer youAt Suncorp, we?ôre here to build futures and protect what matters ??and that includes your career. You?ôll join a collaborative, supportive environment where you can grow, learn, and thrive.Competitive annual salary + performance-based bonuses.Flexible work arrangements??a hybrid working model that lets you work from home and the office ??2 days working from home per week.Employee discounts and rewards??exclusive offers at over 400 major Australian retailers, including Myer, David Jones, Coles, and Woolworths, as well as discounts on Suncorp products and insurance.Study support??we encourage ongoing learning and offer study support to eligible employees.Parental leave??20 weeks of paid parental leave for primary carers.Wellness programs??including discounts on health insurance and gym memberships.Note:Specific benefits may vary depending on role, level, and location.For more on our employee benefits,Click HereChase the Sun ??Apply Now!If this sounds like the opportunity you?ôve been looking for, apply online today!At Suncorp, we?ôre committed to building futures and protecting what matters. We embrace diversity and encourage you to apply?îeven if you don?ôt meet every requirement. We?ôd love to hear from you!At Suncorp we believe we are our best when our workforce is as diverse, talented and passionate as the communities in which we live and operate, and where our people feel included, valued and connected. We are passionate about inspiring our people by creating a diverse, accessible, and inclusive culture, offering flexible work, career development and internal mobility, and building connected relationships amongst our team members and with our customers.If you require more information or any support and adjustments to participate equitably in our recruitment process or in the workplace, we encourage you to contactJenna.Halfpenny@suncorp.com.aufor a confidential conversation.",https://www.seek.com.au/job/86082305&ref=search-standalone
Clinical Coder,North West Private Hospital Queensland Ramsay Health,"Everton Park, Brisbane QLD",$43.37 - $47.82 based on experience,,29/07/2025,"About the RoleReporting to the Health Information Manager, the Clinical Coder is responsible for accurately assigning diagnosis and procedure codes to all inpatient episodes using current coding standards. Your work directly contributes to the hospital?ôs casemix management, funding, and data quality.Key responsibilities include:Assign accurate and timely codes in accordance with ICD-10-AM, ACHI, and Australian Coding Standards.Support data integrity for billing, morbidity collections, statistical analysis, quality programs, and DRG allocation.Participate in internal and external coding audits and documentation quality assurance.Assist with clinical documentation queries and liaise with hospital staff to ensure coding accuracy.Uphold confidentiality and comply with all relevant legislative requirements.About YouYou are an experienced coder with a strong understanding of health classification systems, excellent attention to detail, and the ability to work independently and collaboratively.You will bring:Minimum 4 years??clinical coding experience in a hospital setting.HIMAA Clinical Coding and Medical Terminology qualification or a relevant Health Information Management degree.Eligibility for HIMAA membership.Proficiency in ICD-10-AM (13th Edition), ACHI, and ACS standards.Strong knowledge of DRGs, Casemix, and private hospital funding models.Ability to liaise with clinicians and manage documentation quality.Excellent time management, accuracy, and organisational skills.Sound knowledge of medical terminology and privacy legislation.Desirable:Experience with Solventum (formerly 3M) CodefinderFamiliarity with MEDITECH or similar patient administration systemsPrevious private hospital coding experience.Remuneration:On offer is base hourly rate of between$43.37 - $47.82based on experience level and qualifications + superannuation, exclusive of penalties or allowances.What?ôs in it for you?Professional Advancement:Recognition, Rewards, Professional Development, and Employee referral programs. Free access to LinkedIn Learning, education scholarships and the Ramsay Leadership Academy to support career progression.Discounts:Ramsay Rewards - Access great deals at major retailers. Hospital, Allied Health & Pharmacy discounts -?you?ôll pay less for hospital cover and receive higher extras limits for things like General and Major Dental.Health and Wellbeing:Flexible work opportunities with the ability to have a say in your roster, Flexible Leave Program, and a free Employee Assistance Program offering access to confidential counselling, coaching and support 24/7.Leisure/Social/Financial:Discounts for leisure travel with selected Hotels, salary sacrifice opportunities?e.g., airport lounge membership, self-education expenses, novated leasing and more.About UsNorth West Private Hospital is a fully accredited surgical, obstetric and medical hospital situated 15 mins north west of the Brisbane CBD in the leafy suburb of Everton Park. It is an acute care hospital committed to providing the highest standards of specialised services, skilled personnel and sophisticated technologies.Ramsay Health Care is committed to Child Safety.? Details of our commitment are set out in our Code of Conduct, available atwww.ramsayhealth.comRequirementsMust provide aNational Policecheck conducted within the previous 12 monthsDepending on the role, Ramsay may require aWorking-With-Childrencheck andproof of immunisationagainst infectious diseases.To ApplyAll applications must be lodged online. Applications received via email will not be reviewed. Applications made by recruitment agencies will not be considered.If you have any enquiries regarding this opportunity, please do not hesitate to contact Patricia Avey via email ataveyp@ramsayhealth.com.au",https://www.seek.com.au/job/86080937&ref=search-standalone
